titulo,enlace,imagen,descripcion,fecha,contenido
"¡Bienvenidas al corazón de nuestras tradiciones! Neiva abrió las puertas de la ciudad, para recibir a las 21 candidatas al Reinado Nacional del Bambuco",https://www.huila.gov.co/cultura-y-turismo/publicaciones/15918/bienvenidas-al-corazon-de-nuestras-tradiciones-neiva-abrio-las-puertas-de-la-ciudad-para-recibir-a-las-21-candidatas-al-reinado-nacional-del-bambuco/,https://www.huila.gov.co/info/huila_bco/media/pub/thumbs/thpub_400X400_15918.webp,"Con un nutrido y colorido desfile por la ruta oficial, se dio oficialmente la bienvenida a las embajadoras departamentales quienes estarán tras la corona de la nueva soberana nacional del Sanjuanero h",Última modificación27/06/2025,"Con un nutrido y colorido desfile por la ruta oficial, se dio oficialmente la bienvenida a las embajadoras departamentales quienes estarán tras la corona de la nueva soberana nacional del Sanjuanero huilense. Neiva, 26 de junio de 2025. Con la elección de la representante del Huila, está completo el ramillete de señoritas participantes por la corona nacional, como embajadora de nuestra cultura. La avenida Circunvalar, ruta oficial de los desfiles en esta versión No 64 del Festival del Bambuco en San Juan y San Pedro, fue el lugar donde se dieron cita las 21 candidatas participantes en este certamen, para desfilen y cautivar al público asistente, con su carisma y espontaneidad que las caracteriza. Con un amplio recorrido, una a una las candidatas desfilaron acompañadas de comparsas, grupo de danzas y bandas sinfónicas, que puso a gozar a propios y visitantes, entonando notas propias de nuestras melodías huilenses que cautivan los corazones de quienes visitan nuestra tierra de promisión. El ramillete lo encabezó la reina popular, la primera participante embajadora de la cultura local, seguidamente la reina nacional del bambuco 2024, quien, durante un año se encargó de llevar nuestro legado cultural a cada rincón de país y del mundo entero. Son 21 departamentos que dijeron sí a esta versión No. 64 de nuestro festival, que se pegaron la rodadita y llegaron al departamento del Huila, con sus representantes para participar y convertirse en la nueva soberana nacional. El ramillete se conforma de la siguiente manera: El próximo domingo 29 de junio, en el Parque de la Música Jorge Villamil Cordovez, se conocerá el nombre de la nueva embajadora nacional de la cultura huilense 2025. Reciben candidatas reinado nacional Bambuco 27/06/2025 Reciben candidatas reinado nacional Bambuco 27/06/2025 Reciben candidatas reinado nacional Bambuco 27/06/2025 Reciben candidatas reinado nacional Bambuco 27/06/2025 Reciben candidatas reinado nacional Bambuco 27/06/2025 Reciben candidatas reinado nacional Bambuco 27/06/2025 Reciben candidatas reinado nacional Bambuco 27/06/2025 Reciben candidatas reinado nacional Bambuco 27/06/2025 Reciben candidatas reinado nacional Bambuco 27/06/2025 Reciben candidatas reinado nacional Bambuco 27/06/2025 × Close Anterior Siguiente Reciben candidatas reinado nacional Bambuco Reciben candidatas reinado nacional Bambuco Reciben candidatas reinado nacional Bambuco Reciben candidatas reinado nacional Bambuco Reciben candidatas reinado nacional Bambuco Reciben candidatas reinado nacional Bambuco Reciben candidatas reinado nacional Bambuco Reciben candidatas reinado nacional Bambuco Reciben candidatas reinado nacional Bambuco Reciben candidatas reinado nacional Bambuco "
"Con Caren Julieth Perdomo Salazar, el municipio de Palermo se alzó por quinta vez con el título de Reina Departamental del Bambuco",https://www.huila.gov.co/cultura-y-turismo/publicaciones/15914/con-caren-julieth-perdomo-salazar-el-municipio-de-palermo-se-alzo-por-quinta-vez-con-el-titulo-de-reina-departamental-del-bambuco/,https://www.huila.gov.co/info/huila_bco/media/pub/thumbs/thpub_400X400_15914.webp,"Caren Julieth Perdomo Salazar, candidata por el municipio de Palermo, fue elegida como Reina Departamental del Bambuco, definición que también escogió a Catalina Díaz Molina de Neiva, como Virreina, y",Última modificación25/06/2025,"Caren Julieth Perdomo Salazar, candidata por el municipio de Palermo, fue elegida como Reina Departamental del Bambuco, definición que también escogió a Catalina Díaz Molina de Neiva, como Virreina, y a Laura Valentina Cáceres, del municipio de La Plata, como Princesa. 24 de junio de 2025. “Que orgullo tan inmenso ser la embajadora de mi departamento, de mi municipio de Palermo y de la cultura de toda una región. Estoy inmensamente feliz y agradecida con Dios y todo un pueblo que siempre me dio su apoyo”, manifestó la nueva representante del Huila al Reinado Nacional del Bambuco. Ella bailó junto a Jairo Moya, uno de los parejos que, con su trabajo y dedicación, contribuye a mantener viva la tradición de la danza más significativa dentro del folclor del Huila. El resultado se dio en medio de una velada de lujo, con el lleno total del Parque de la Música Jorge Villamil Cordovez, dónde las 20 candidatas que aspiraban la corona departamental presentaron su mejor interpretación del Sanjuanero huilense (que correspondía al 60% de la evaluación final del jurado calificador). La velada de elección de este martes cerró una maratónica jornada que inició con la entrevista del jurado calificador, que tuvo en cuenta varios criterios de puntuación: Interpretación del sanjuanero 60%, Muestra folclórica representativa de su ente territorial 15% Cultura general 10%; Carisma 10%; Popularidad 5% para un Total del 100% El selecto jurado conformado por: ✅José Alfonso Vargas: Psicólogo, Especialista en proyectos de desarrollo social, Magister en cultura, territorio y conflicto, Académico, ex rector universitario, ex presidente de ASCUN cultura zona centro occidente. ✅Ana María Valderrama Gaspar: Abogada especializada en Derecho Penal, Criminología y Derecho Administrativo. Señorita Neiva 1994. ✅Angélica María Arbeláez Sánchez: Comunicadora Social y Periodista, Especialista en Gerencia de Marketing Estratégico Event & Wedding Planner Certificada, Empresaria Profesional con más de 14 años de experiencia en el sector logístico de eventos corporativos y sociales. ✅María Gisela Ramírez: Bacterióloga, con especialización en gerencia en salud y en educación ambiental y desarrollo sostenible. ✅Rocío Luna: Médico especialista en otorrinolaringología y cirugía plástica facial, docente pregrado universidad Surcolombiana, virreina nacional de la belleza en Cartagena, virreina miss mundo y reina de las Américas en Londres; quienes escogieron además de Garzón, Pitalito y Rivera, a las participantes por San Agustín, Palermo, Neiva y La Plata. La nueva reina departamental del Bambuco también sumó, el día de ayer, con una bella exhibición dancística y musical, evocando la profunda tradición de su pueblo, de su cultura y de sus raíces como embajadora municipal y ahora soberana departamental. Premiación ● Reina $10.000.00 millones de pesos en efectivo Traje típico de la diseñadora Cielo Ramos Tv de 52 pulgadas que entrega Punto Net 1 año en tratamiento en servicios de Alma Stetic Bono de regalo por $5.000.000 millones de Macrodent ● Virreina Premiación en efectivo $5.000.000 Bono por $4.000.000 de Alma ALMA Stetic Bono de regalo blanqueamiento denral en Macrodent ● Princesa $3.500.000, en efectivo Bono de regalo por $2.000.000 de pesos en servicios de Alma Stetic Bono de regalo en aclaramiento en Macrodent Virreina y princesa, la decisión del jurado Catalina Díaz Molina, de Neiva, agradeció a su municipio por el apoyo recibido, y destacó que ese respaldo se refleja “en ser hoy la nueva virreina departamental del Bambuco”. La señorita Laura Valentina Cáceres hoy orgullosa princesa, se declaró “muy feliz de haber llegado hasta este punto. Muchas gracias por tanto apoyo, a mi pueblo, decirle que aquí tiene su embajadora”. María Angélica Arbeláez, integrante del jurado calificador, reconoció la labor de las participantes y la majestuosa interpretación de cada baile, “cada una de las candidatas fueron dignas representantes de sus municipios. Bailaron de manera excelente, son hermosas y muy inteligentes. Fue una experiencia espectacular para poder resaltar nacional e internacionalmente nuestro folclor”. Una presentación musical sin precedentes La noche inició con el opening, donde cada una de las candidatas se presentaron públicamente ante los miles de asistentes; seguidamente en el primer bloque de candidatas, la noche fue amenizada por el grupo promisión, que puso a gozar a los asistentes. Como parte de las intervenciones musicales, estuvo el reconocido Grupo Poder, con una fabulosa presentación que puso a gozar a los más de tres mil asistentes que se dieron cita para disfrutar de esta noche de música y folclor. Una ventana del Huila a Colombia y al mundo El gobernador del Huila destacó los alcances del Festival, y más en esta etapa departamental, “qué orgullosos nos sentimos de este pueblo huilense, de que el folclor, la cultura y la tradición nos una como región”. La secretaria de Cultura Liliana Quimbaya, dijo que esta ha sido una “oportunidad que el Huila tiene para mostrar todo lo bello que contamos en materia turística y cultural. La transmisión virtual fue un éxito, con una enorme interacción con nuestro público. Finalmente, como Reina de los edecanes fue elegida la candidata del municipio de Nátaga, Daian Stephanie Díaz. Palermo nueva reina Deptal Bambuco 25/06/2025 Palermo nueva reina Deptal Bambuco 25/06/2025 Palermo nueva reina Deptal Bambuco 25/06/2025 Palermo nueva reina Deptal Bambuco 25/06/2025 Palermo nueva reina Deptal Bambuco 25/06/2025 Palermo nueva reina Deptal Bambuco 25/06/2025 Palermo nueva reina Deptal Bambuco 25/06/2025 Palermo nueva reina Deptal Bambuco 25/06/2025 × Close Anterior Siguiente Palermo nueva reina Deptal Bambuco Palermo nueva reina Deptal Bambuco Palermo nueva reina Deptal Bambuco Palermo nueva reina Deptal Bambuco Palermo nueva reina Deptal Bambuco Palermo nueva reina Deptal Bambuco Palermo nueva reina Deptal Bambuco Palermo nueva reina Deptal Bambuco "
"En muestra folclórica, candidatas al Reinado Departamental del Bambuco, enaltecieron riqueza cultural del Huila Grande",https://www.huila.gov.co/cultura-y-turismo/publicaciones/15909/en-muestra-folclorica-candidatas-al-reinado-departamental-del-bambuco-enaltecieron-riqueza-cultural-del-huila-grande/,https://www.huila.gov.co/info/huila_bco/media/pub/thumbs/thpub_400X400_15909.webp,"Este evento hace parte importante del certamen, mostrando lo mejor de la cultura, la gastronomía, el turismo, los ritmos propios de cada municipio a través de la interpretación única de las candidatas",Última modificación24/06/2025,"Este evento hace parte importante del certamen, mostrando lo mejor de la cultura, la gastronomía, el turismo, los ritmos propios de cada municipio a través de la interpretación única de las candidatas. Neiva, 24 de junio de 2025. El Parque de la Música Jorge Villamil Cordovez, se convirtió en el escenario donde la belleza, el carisma y el talento de las 20 candidatas al Reinado Departamental del Bambuco convergieron para exhibir la riqueza folclórica de sus municipios. El evento, que contó con una masiva participación, permitió a los asistentes vibrar con las representaciones culturales que caracterizan a cada rincón del Huila. Cada puesta en escena fue un reflejo del trasegar cultural de los municipios, consolidando a las aspirantes a la corona, como embajadoras de su patrimonio. El bambuco fue el pilar de identidad, y las muestras particulares, el sentir de cada municipio, resaltando el arraigo y la tradición que definen al Huila como tierra de promisión. La muestra folclórica de cada candidata, rindió un sentido homenaje a los elementos más representativos de la cultura de los municipios. Es así como a través de cada presentación, se exaltó la gastronomía, el turismo, los ritmos y danzas típicas, las creencias religiosas, el trabajo admirable de los maestros artesanos y la actividad económica de las diferentes regiones del Huila, dejando ver el enorme el gran legado de tradición y potencial del departamento. Cabe resaltar que el valor del porcentaje para la muestra de las candidatas al Reinado Departamental del Bambuco, corresponde al 10% del valor total que será calificado por el jurado de este importante certamen. “Algo que nos llamó mucho la atención y que nos gustó al final, es como se han apropiado ellas de esas faldas en su presentación, mostrando todo lo alegórico a su municipio”, afirmó Rocío Luna Flórez, quien hace parte del jurado calificador del certamen. Por su parte, Daniel Alvira, reconocido gestor cultural del occidente del Huila, destacó que “En un balance general acerca de las muestras folclóricas, podemos exaltar la gran labor que cada una de las candidatas ha realizado, buscando poner en escena lo mejor del folclor huilense. En cuanto al nivel competitivo, es un nivel muy alto y esperamos que así se siga manteniendo”. Muestra folclórica de candidatas al Reinado Departamental 24/06/2025 Muestra folclórica de candidatas al Reinado Departamental 24/06/2025 Muestra folclórica de candidatas al Reinado Departamental 24/06/2025 Muestra folclórica de candidatas al Reinado Departamental 24/06/2025 Muestra folclórica de candidatas al Reinado Departamental 24/06/2025 Muestra folclórica de candidatas al Reinado Departamental 24/06/2025 Muestra folclórica de candidatas al Reinado Departamental 24/06/2025 Muestra folclórica de candidatas al Reinado Departamental 24/06/2025 Muestra folclórica de candidatas al Reinado Departamental 24/06/2025 Muestra folclórica de candidatas al Reinado Departamental 24/06/2025 × Close Anterior Siguiente Muestra folclórica de candidatas al Reinado Departamental Muestra folclórica de candidatas al Reinado Departamental Muestra folclórica de candidatas al Reinado Departamental Muestra folclórica de candidatas al Reinado Departamental Muestra folclórica de candidatas al Reinado Departamental Muestra folclórica de candidatas al Reinado Departamental Muestra folclórica de candidatas al Reinado Departamental Muestra folclórica de candidatas al Reinado Departamental Muestra folclórica de candidatas al Reinado Departamental Muestra folclórica de candidatas al Reinado Departamental "
DEFINIDAS LAS 20 CANDIDATAS AL REINADO DEPARTAMENTAL DEL BAMBUCO,https://www.huila.gov.co/cultura-y-turismo/publicaciones/15907/definidas-las-20-candidatas-al-reinado-departamental-del-bambuco/,https://www.huila.gov.co/info/huila_bco/media/pub/thumbs/thpub_400X400_15907.webp,"Con la elección de la Señorita Neiva, se completa el selecto grupo de jóvenes que competirán por la corona.",Última modificación23/06/2025,"Con la elección de la Señorita Neiva, se completa el selecto grupo de jóvenes que competirán por la corona. Neiva, 23 de junio de 2025. El Salón de Gobernadores de la Gobernación del Huila se engalanó con la belleza y el carisma de las 20 candidatas que sellaron su compromiso de representar a sus municipios en el Reinado Departamental del Bambuco. La elección de la Señorita Neiva culminó la conformación de este prestigioso grupo. El Gobernador del Huila, Rodrigo Villalba Mosquera, junto con la gestora social del departamento, Ángela Parra, y su hija María Lucía Villalba, presidió la emotiva ceremonia de imposición de bandas a cada una de las candidatas. El acto, estuvo cargado de estas 20 hermosas jóvenes, por convertirse en la nueva soberana departamental del Bambuco. Este año, la nutrida participación aumenta el nivel de exigencia y competencia. Cada candidata encarna la fuerza y la riqueza cultural de su municipio, prometiendo un certamen lleno de talento y tradición. Listado Oficial de Candidatas: Por su parte, el Gobernador de los Huilenses, Rodrigo Villalba afirmó que, “Va a ser un concurso muy competido y de eso se trata, donde va a haber de sobra simpatía, alegría, pero también baile. De modo pues que estamos dando apertura, mañana se completa con el desfile folclórico y luego la noche, la velada de elección y coronación de la Reina departamental”."
Rajaleñas y bambucos laten con fuerza en el alma del Huila,https://www.huila.gov.co/cultura-y-turismo/publicaciones/15906/rajalenas-y-bambucos-laten-con-fuerza-en-el-alma-del-huila/,https://www.huila.gov.co/info/huila_bco/media/pub/thumbs/thpub_400X400_15906.webp,"Como muestra de un legado que sigue vigente en las nuevas generaciones, Neiva se vistió de fiesta a ritmo de rajaleñas y bambucos, donde los protagonistas fueron los niños, quienes orgullosos mostraro",Última modificación23/06/2025,"Como muestra de un legado que sigue vigente en las nuevas generaciones, Neiva se vistió de fiesta a ritmo de rajaleñas y bambucos, donde los protagonistas fueron los niños, quienes orgullosos mostraron su talento a propios y visitantes. Neiva, 23 de junio de 2025. Con un lleno total, la plazoleta del Centro de Convenciones José Eustasio Rivera, fue el escenario perfecto donde los niños del Huila mostraron su talento, durante el Encuentro Departamental Infantil de Rajaleñas “Ulises Charry” y Bambuco Tradicional, desarrollando en el marco de la versión 64 del Festival del Bambuco en San Juan y San Pedro. Sobre las 4:00 de la tarde de este domingo 22 de junio, se dio comienzo a este magnífico evento, inicialmente con la interpretación del baile de bambuco tradicional, del que participaron 10 parejas de niños de los municipios de Aipe, Neiva, y Tello, quienes demostraron no solo el dominio del escenario, sino el amor por nuestra cultura, llevando en su ritmo obras musicales de los maestros Silva y Villalba, Cantalicio Rojas, y Raúl Rivera. Cada pareja fue ovacionada por el público debido a la sutileza y gallardía con la que bailaron temas reconocidos de la cultura huilense como La Mistela, Ojo al toro, y Los Potros, dejando que cada nota recorriera su cuerpo hasta convertirse en una herencia que palpita no solo en sus corazones, sino en el alma del Huila. Posteriormente el turno fue para los grupos de rajaleña infantil, que, al ritmo de tambora, tiple, esterilla, cien pies, carángano, chucho, y guitarra, sumado al grito picaresco con el que se evoca la memoria de grandes cultores de este departamento como don Ulises Charry, hizo vibrar desde los niños hasta los adultos mayores, algunos de los cuales no vacilaron en sacar parejo y aprovechar el espacio para bailar. Agrupaciones como los Guipas de Rumichaca, Los Zumbambicos, Las Garzoneñas, Los Pescuezones, Agrupación Folclórica Los Opitas, Los Pescueguambis, Grupo de Rajaleña Juvenil ""Aires Mauxiforianos de Fortalecillas"", Agrupación Folclórica los Rucios de Tuco Reina, Los Pescueñitos de Paicol, Los Guambitos, y los Zumbas del Magdalena, deleitaron a propios y turistas quienes se contagiaron y tararearon las coplas picarescas, que cuentan el vivir cotidiano de un pueblo trabajador y alegre. Este derroche de talento por parte de nuestros niños y jóvenes, es una muestra esperanzadora que las tradiciones se mantienen firmes, donde su majestad El Rajaleña, es el latido cultural del Huila, un legado que debemos promover en las nuevas generaciones, pues a través de sus ritmos y letras, se cuenta la idiosincrasia de un pueblo reconocido por su  hospitalidad y laboriosidad que celebra la vida en sus fiestas, por lo que es fundamental preservar esta tradición para que las futuras generaciones puedan conocer y apreciar su rica herencia. Bambucos y Rajaleñas 23/06/2025 Bambucos y Rajaleñas 23/06/2025 Bambucos y Rajaleñas 23/06/2025 Bambucos y Rajaleñas 23/06/2025 Bambucos y Rajaleñas 23/06/2025 Bambucos y Rajaleñas 23/06/2025 Bambucos y Rajaleñas 23/06/2025 Bambucos y Rajaleñas 23/06/2025 Bambucos y Rajaleñas 23/06/2025 Bambucos y Rajaleñas 23/06/2025 × Close Anterior Siguiente Bambucos y Rajaleñas Bambucos y Rajaleñas Bambucos y Rajaleñas Bambucos y Rajaleñas Bambucos y Rajaleñas Bambucos y Rajaleñas Bambucos y Rajaleñas Bambucos y Rajaleñas Bambucos y Rajaleñas Bambucos y Rajaleñas "
"Anunciados inscritos al Concurso Nacional de Interpretación muscial “Anselmo Durán Plazas""",https://www.huila.gov.co/cultura-y-turismo/publicaciones/15903/anunciados-inscritos-al-concurso-nacional-de-interpretacion-muscial-anselmo-duran-plazas/,https://www.huila.gov.co/info/huila_bco/media/pub/thumbs/thpub_400X400_15903.webp,"La Corporación para la Promoción de la Cultura y el Turismo del Huila, CORPOSANPEDRO, en conjunto con el Gobierno Departamental “Por un Huila Grande”, se complace en anunciar oficialmente la lista de",Última modificación22/06/2025,"La Corporación para la Promoción de la Cultura y el Turismo del Huila, CORPOSANPEDRO, en conjunto con el Gobierno Departamental “Por un Huila Grande”, se complace en anunciar oficialmente la lista de inscritos al Concurso Nacional de Interpretación Musical “Anselmo Durán Plazas”, evento de gran relevancia en el marco del 64° Festival del Bambuco en San Juan y San Pedro. A la Convocatoria Pública No. 009 de 2025 respondieron 24 talentosos participantes provenientes de diferentes regiones del país, entre solistas vocales e instrumentales, duetos, tríos, estudiantinas y agrupaciones musicales, reafirmando el compromiso, la pasión y el talento que caracterizan la identidad artística de nuestra región y de Colombia entera. Un Festival que Enaltece el talento de nuestros músicos huilenses. Este concurso tiene como propósito estimular y exaltar a los intérpretes agrupados en diversos formatos musicales, quienes se dedican a la interpretación y difusión del amplio repertorio de la música andina colombiana, en todas sus manifestaciones: Danza, Torbellino, Sanjuanero, Rumba criolla, Rumba campesina, Caña, Rajaleñas, Bunde, Redova, Fandanguillo, Chotis, Bambuco, Pasillo, Vals, Guabina y Sanjuanito. El proceso de selección se llevó a cabo en dos grandes modalidades: Vocal e Instrumental, cada una con sus respectivas categorías. Los criterios de evaluación incluyeron: El Concurso Nacional de Interpretación Musical se llevará a cabo el próximo 21 de junio de 2025, en la emblemática Plazoleta del Centro Cultural y de Convenciones José Eustasio Rivera en Neiva. Los resultados detallados de los inscritos están disponibles en el cuadro anexo a este comunicado, así como en los sitios web oficiales www.huila.gov.co , www.corposanpedro.org Invitamos a todos los artistas participantes, a la ciudadanía y al público en general a consultar esta información y a prepararse para vivir con orgullo, emoción y alegría el 64° Festival del Bambuco en San Juan y San Pedro. ¡La música andina colombiana nos une! Concurso Nacional Interpretación Musical 22/06/2025 Concurso Nacional Interpretación Musical 22/06/2025 Concurso Nacional Interpretación Musical 22/06/2025 Concurso Nacional Interpretación Musical 22/06/2025 Concurso Nacional Interpretación Musical 22/06/2025 Concurso Nacional Interpretación Musical 22/06/2025 Concurso Nacional Interpretación Musical 22/06/2025 Concurso Nacional Interpretación Musical 22/06/2025 Concurso Nacional Interpretación Musical 22/06/2025 × Close Anterior Siguiente Concurso Nacional Interpretación Musical Concurso Nacional Interpretación Musical Concurso Nacional Interpretación Musical Concurso Nacional Interpretación Musical Concurso Nacional Interpretación Musical Concurso Nacional Interpretación Musical Concurso Nacional Interpretación Musical Concurso Nacional Interpretación Musical Concurso Nacional Interpretación Musical"
