titulo,enlace,imagen,descripcion,fecha,contenido
Apoyo a la realización de Proceso de Formación Musical en Formato Bandistico y Áres Conexas,https://www.huila.gov.co/cultura-y-turismo/publicaciones/14633/apoyo-a-la-realizacion-de-proceso-de-formacion-musical-en-formato-bandistico-y-ares-conexas/,https://www.huila.gov.co/info/huila_bco/media/pub/thumbs/thpub_400X400_14633.webp,Apoyo a la realización de Proceso de Formación Musical en Formato Bandistico y Áres Conexas,Última modificación22/01/2024, Ver Convocatoria ... Visualizar 0.20MB Nombre aviso cultura 2024.pdf Descripción APOYO A LA REALIZACIÓN DE PROCESOS DE FORMACIÓN MUSICAL EN FORMATO BANDISTICO Y ÁREAS CONEXAS Categoría Convocatorias 2024 Tipo de documento Documentos de interes Fechas Expedición: 22/01/2024 Publicación: 22/01/2024
Cerca de 240 mil vehículos se espera que lleguen al Huila en puentes festivos de fin de año y reyes,https://www.huila.gov.co/cultura-y-turismo/publicaciones/14619/cerca-de-240-mil-vehiculos-se-espera-que-lleguen-al-huila-en-puentes-festivos-de-fin-de-ano-y-reyes/,https://www.huila.gov.co/info/huila_bco/media/pubInt/thumbs/thpubInt_400X400_14619.webp,Campoalegre y Villavieja son algunos de los municipios en donde se adelantan capacitaciones de seguridad vial para todos los actores viales. Se busca así prevenir siniestros en esta temporada de fin d,Última modificación29/12/2023,"Campoalegre y Villavieja son algunos de los municipios en donde se adelantan capacitaciones de seguridad vial para todos los actores viales. Se busca así prevenir siniestros en esta temporada de fin de año. Neiva, 28 de diciembre de 2023. El equipo Instituto de Transporte y Tránsito del Huila, liderado por el director Mauro Saúl Sánchez Zambrano se ha venido preparando para esta temporada de fin de año con diferentes actividades de seguridad vial en todo el departamento. Es por ese motivo que durante esta semana se ha venido visitando diferentes municipios, como Campoalegre y Villavieja, para llevar a cabo capacitaciones de seguridad vial y hacer entrega de elementos de seguridad como cascos a los motociclistas, quienes presentan mayor accidentalidad en las vías. Efectivamente, la mayoría de los infractores viales son los motociclistas con un 68%, asimismo los fallecidos por accidente de tránsito son en mayor número los motociclistas en un 62%. Sin embargo el objetivo del Instituto de Transporte y Tránsito del departamento del Huila es prevenir que se presenten siniestros viales durante esa temporada de fin de año, y arrancar un 2024 sanos y salvos. El director Mauro Saúl Sánchez hace un llamado contundente a la prudencia a todos los actores viales que visiten nuestro departamento, para que durante este fin de año se haga buen uso y respeto de las normas de tránsito, como también llevar al día todos los documentos vigentes. Recuerda que en casa te esperan. #HuilaCreceEnSeguridadVial 240.000 vehiculos visitarán el Huila en fin de año 29/12/2023 240.000 vehiculos visitarán el Huila en fin de año 29/12/2023 240.000 vehiculos visitarán el Huila en fin de año 29/12/2023 240.000 vehiculos visitarán el Huila en fin de año 29/12/2023 240.000 vehiculos visitarán el Huila en fin de año 29/12/2023 240.000 vehiculos visitarán el Huila en fin de año 29/12/2023 240.000 vehiculos visitarán el Huila en fin de año 29/12/2023 × Close Anterior Siguiente 240.000 vehiculos visitarán el Huila en fin de año 240.000 vehiculos visitarán el Huila en fin de año 240.000 vehiculos visitarán el Huila en fin de año 240.000 vehiculos visitarán el Huila en fin de año 240.000 vehiculos visitarán el Huila en fin de año 240.000 vehiculos visitarán el Huila en fin de año 240.000 vehiculos visitarán el Huila en fin de año "
Museo A Cielo Abierto: un proyecto que promueve el arte huilense,https://www.huila.gov.co/cultura-y-turismo/publicaciones/14612/museo-a-cielo-abierto-un-proyecto-que-promueve-el-arte-huilense/,https://www.huila.gov.co/info/huila_bco/media/pubInt/thumbs/thpubInt_400X400_14612.webp,"Llega al Huila una iniciativa que expone inspiradoras obras de artistas huilenses en los municipios de Rivera, Pitalito, y el corregimiento de La Jagua.",Última modificación22/12/2023,"Llega al Huila una iniciativa que expone inspiradoras obras de artistas huilenses en los municipios de Rivera, Pitalito, y el corregimiento de La Jagua. Neiva, 20 de diciembre de 2023. La Secretaría de Cultura del Huila, a través de la Red Departamental de Museos y en articulación con la Corporación Pitalito Ciudad Museo inauguran el proyecto “Mi Huila, Museo a Cielo Abierto”, una iniciativa que pretende dinamizar la economía y el turismo de los municipios de Rivera, Pitalito, y el corregimiento La Jagua a través de la exposición de obras de artistas huilenses. “Este proyecto consiste en transformar a Pitalito en una galería de arte a cielo abierto, pero el objetivo no es sólo embellecer el pueblo, es gestar un apalancamiento económico que le permita al municipio, al territorio y a la comunidad dinamizarse a través del turismo. Desde luego, si no nos hubiese escuchado el ingeniero Luis Enrique Dussán, no estaríamos contando este cuento”, indicó Geovanny Rojas, presidente de la Corporación Pitalito Ciudad Museo. Para la ejecución de este proyecto se realizó un proceso de convocatoria y selección que permitió la recopilación de obras de artistas huilenses profesionalizados y no profesionalizados que han decidido incursionar en el mundo artístico formándose de manera autónoma, oriundos de Pitalito, Rivera, Garzón, entre otros municipios. Esta exposición se conforma con obras de 2x4m, resultado de procesos de investigación y/o sentires populares que reflejan una realidad. Así, Mi Huila: Museo a Cielo Abierto, es un proyecto que expresa las diferentes búsquedas y formas de pensar la pintura, el resultado del talento artístico huilense que invita a reflexionar sobre diversas temáticas de interés general: naturaleza, religión, familia, historia, mitos y leyendas, generando en la comunidad nuevos sentires y formas de entender el mundo. “Tenemos obras desde la figuración, obras muy geométricas que nos recuerdan a una fracción de los 50’s, abstracción, realismo. Hay una variación bastante interesante y esto demuestra riqueza ya que estamos hablando de una sociedad que está alejada de los circuitos del arte. En el Huila tenemos pocas galerías de arte, entonces este museo que es público le da información visual a niños, jóvenes y adultos”, afirmó Karen Corredor Rodríguez, asistente director de obra. Las expectativas de este proyecto se extienden al contexto internacional con la búsqueda del reconocimiento de organizaciones mundiales como la UNESCO (Organización de las Naciones Unidas para la Educación, la Ciencia y la Cultura) del municipio de Pitalito como una ciudad Museo, a través de la próxima edición de un libro de arte producto de este inspirador proyecto. Museo a cielo abierto 22/12/2023 Museo a cielo abierto 22/12/2023 Museo a cielo abierto 22/12/2023 Museo a cielo abierto 22/12/2023 Museo a cielo abierto 22/12/2023 Museo a cielo abierto 22/12/2023 Museo a cielo abierto 22/12/2023 Museo a cielo abierto 22/12/2023 Museo a cielo abierto 22/12/2023 Museo a cielo abierto 22/12/2023 × Close Anterior Siguiente Museo a cielo abierto Museo a cielo abierto Museo a cielo abierto Museo a cielo abierto Museo a cielo abierto Museo a cielo abierto Museo a cielo abierto Museo a cielo abierto Museo a cielo abierto Museo a cielo abierto"
El Huila será anfitrión en el encuentro iberoamericano de turismo rural y sostenible en 2024,https://www.huila.gov.co/cultura-y-turismo/publicaciones/14594/el-huila-sera-anfitrion-en-el-encuentro-iberoamericano-de-turismo-rural-y-sostenible-en-2024/,https://www.huila.gov.co/info/huila_bco/media/pubInt/thumbs/thpubInt_400X400_14594.webp,"El departamento del Huila será el escenario del IX Encuentro Iberoamericano de Turismo Rural 2024, el evento más importante de turismo rural de Latinoamérica, y recibirá a 22 países invitados.",Última modificación13/12/2023,"El departamento del Huila será el escenario del IX Encuentro Iberoamericano de Turismo Rural 2024, el evento más importante de turismo rural de Latinoamérica, y recibirá a 22 países invitados. Neiva, 12 de diciembre de 2023. “Algo debe estar haciendo bien el Huila, cuando ha sido tenido en cuenta para el desarrollo de tan importante certamen a nivel Iberoamericano, de un sector de la economía que se desarrolla aceleradamente, no solo en Colombia, sino prácticamente en todo el mundo.” Así lo expresó Rudesindo Moreno Rojas, presidente de la Junta Directiva de la Confederación de la Industria Turística Colombiana “Confetur”, en un significativo evento que se desarrolló en la ciudad de Neiva, en el que esta agremiación le hizo entrega de un reconocimiento al gobernador del Huila, ingeniero Luis Enrique Dussán López, por su compromiso con el sector turístico en este territorio. Son muchas las cosas que se están haciendo en esta parte del país, no solamente para fortalecer el turismo, sino a nivel general, para forjar desarrollo económico y social en todo el departamento del Huila. Por eso con gran beneplácito el gobierno departamental recibió la noticia de que el Huila ha sido escogido como el escenario del IX Encuentro Iberoamericano de Turismo Rural 2024, evento en el que recibirá a 22 países invitados. Y por qué en el departamento del Huila Como lo expresara el diario económico Portafolio, “esta elección se da gracias al significativo incremento de la competitividad turística que ha experimentado el departamento en los últimos años. Según el último informe del Índice de Competitividad Turística Regional de Colombia, el Huila ha logrado un hito histórico al posicionarse entre los 10 departamentos más competitivos a nivel nacional en materia turística. Este logro resalta el compromiso y los esfuerzos sostenidos del Huila para ofrecer experiencias únicas a los visitantes, convirtiéndolo en un destino privilegiado para este importante encuentro iberoamericano”. Es importante resaltar que el gobierno Huila Crece, ha hecho grandes esfuerzos para generar avances en materia de vías e infraestructura, con lo que se facilita el acceso a todos los destinos turísticos del departamento, pero además en materia de promoción a través de la Feria Internacional de Café, Cacao y Agroturismo, entre otras acciones como la creación y consolidación de cuatro clústeres turísticos. Clúster Norte: Este clúster abarca los municipios de Baraya, Tello, Colombia, Aipe, Rivera, Campoalegre, Yaguará, Palermo, Neiva y Villavieja, donde encontraremos la Ecorregión Tatacoa, Neiva Ciudad Villamil y la Ruta Tierra de Promisión. Clúster Centro: La Ruta Mágica del Café para promocionar las maravillas cafeteras y la exuberancia de la región central del departamento. Clúster Occidente: Con territorio Páez como centro de atención, esta zona destaca por su riqueza cultural y la diversidad de experiencias que se pueden vivir con deportes extremos. Clúster Sur: En el territorio Mágico y Ancestral del sur del departamento, se fusiona el patrimonio cultural y la biodiversidad natural, presentando lugares emblemáticos como el Parque Arqueológico de San Agustín, y una inigualable oferta de conexión con la naturaleza. Huila sede Encuentro Turismo 13/12/2023 Huila sede Encuentro Turismo 13/12/2023 Huila sede Encuentro TurismoHuila sede Encuentro Turismo 13/12/2023 Huila sede Encuentro Turismo 13/12/2023 Huila sede Encuentro Turismo 13/12/2023 Huila sede Encuentro Turismo 13/12/2023 Huila sede Encuentro Turismo 13/12/2023 × Close Anterior Siguiente Huila sede Encuentro Turismo Huila sede Encuentro Turismo Huila sede Encuentro TurismoHuila sede Encuentro Turismo Huila sede Encuentro Turismo Huila sede Encuentro Turismo Huila sede Encuentro Turismo Huila sede Encuentro Turismo"
La Gobernación del Huila fortalece el turismo regional a través de la creación de los cuatro clústeres turísticos,https://www.huila.gov.co/cultura-y-turismo/publicaciones/14583/la-gobernacion-del-huila-fortalece-el-turismo-regional-a-traves-de-la-creacion-de-los-cuatro-clusteres-turisticos/,https://www.huila.gov.co/info/huila_bco/media/pubInt/thumbs/thpubInt_400X400_14583.webp,"La Secretaría de Desarrollo Económico y Turismo del Huila ha llevado a cabo un importante evento en el marco de Huila Fest 2023 donde hizo entrega oficial de los cuatro clústeres turísticos del Huila,",Última modificación12/12/2023,"La Secretaría de Desarrollo Económico y Turismo del Huila ha llevado a cabo un importante evento en el marco de Huila Fest 2023 donde hizo entrega oficial de los cuatro clústeres turísticos del Huila, esto toma importancia para el desarrollo turístico de la región al potenciar y promover las riquezas naturales, culturales e históricas que caracterizan al departamento. Neiva, 07 de diciembre de 2023. En un esfuerzo por resaltar la diversidad y atractivos del territorio huilense, se han definido estratégicamente cuatro clústeres que destacan diferentes zonas y aspectos de interés turístico de nuestro departamento. “Hicimos la entrega formal de ese gran producto destino “Huila un Paraíso por Descubrir” donde trabajamos en el fortalecimiento del turismo y dejamos cuatro clúster funcionando en el departamento del Huila, el del norte con la Ecorregión Tatacoa, Neiva Ciudad Villamil, y la Ruta Tierra de Promisión. El clúster del centro con la Ruta Mágica del Café; el occidente del Huila con Territorio Páez, y en el sur con el Territorio Mágico y Ancestral, donde encontramos la Ruta Mágica del Café corredor del sur, encontramos patrimonio y cultura con el Parque Arqueológico de San Agustín, y la biodiversidad, la naturaleza”, explicó Oscar Eduardo Trujillo Cuenca, Secretario de Desarrollo Económico y Turismo del Huila. Clúster Norte: Este clúster abarca los municipios de Baraya, Tello, Colombia, Aipe, Rivera, Campoalegre, Yaguará, Palermo, Neiva y Villavieja, donde encontraremos la Ecorregión Tatacoa, Neiva Ciudad Villamil y la Ruta Tierra de Promisión, presentando un abanico de atractivos naturales y culturales que invitan a explorar y disfrutar de estas fascinantes zonas del norte del Huila. Llegar al Huila es adentrarse en un paraíso por descubrir, en la “Tierra de Promisión de José Eustasio Rivera”, en un territorio cuyas diferencias altitudinales lo hacen diverso en unidades de paisaje, ecosistemas, biodiversidad, parches de cultivo y cultura. En el norte paisajes erosionados de formaciones serpenteantes de colores ocres y grises, adornados por matorrales espinosos de verdes contrastantes. En la noche, una cúpula celeste con unas condiciones especiales para la observación de estrellas y constelaciones que le abre a los visitantes una ventana al universo. Clúster Centro: La Ruta Mágica del Café es el punto focal de este clúster, promoviendo las maravillas cafeteras y la exuberancia de la región central del departamento. El centro del departamento presenta una variada diversidad de paisajes, ecosistemas y fauna silvestre, desde el bosque seco tropical, la zona cafetera, la zona productiva de montaña, hasta los bosques húmedos y el páramo. Se destaca de manera especial la zona cafetera que por su topografía es muy accesible y cuenta con muy buenas vías que han permitido el desarrollo de un producto turístico en torno a las actividades culturales de la producción cafetera, al paisaje cafetero y a las áreas protegidas que se encuentran a su alrededor. Las estribaciones de la cordillera Oriental son un escenario natural para la contemplación del paisaje del Valle de Río Magdalena, de la Cordillera Central, y de noche de pueblos y viviendas campesinas que encienden sus luces al atardecer, esto ha permitido la adecuación de miradores estratégicos que ofrecen diferentes servicios al turista, como hospedajes singulares, gastronomía típica e internacional, senderismo, recorridos cafeteros y los llamados sport fotográficos donde el visitante posa en un ambiente creado para sus fotografías. Clúster Occidente: Con territorio Páez como centro de atención, esta zona destaca por su riqueza cultural y la diversidad de experiencias que se pueden vivir con deportes extremos. Desde las cumbres nevadas del Volcán Nevado del Huila desciende vertiginosamente el río Páez, para al llegar a la llanura recibir las aguas de río La Plata, que viene de los páramos de Puracé, y allí, enmarcado en el río Magdalena, la serranía de Las Minas y La cordillera Central se ubica un territorio lleno de magia de sus culturas ancestrales, de sus diversas unidades de paisaje y ecosistemas que van desde el bosque seco tropical,  las cumbres nevadas, pasando por bosques húmedos de montaña y valles de frailejones en los páramos. El territorio Páez cuenta con unas formaciones geológicas singulares que dan origen a valles escondidos, cavernas, cañones, cascadas, pozos naturales y fuentes de aguas cristalinas que permanecen durante todo el año. Clúster Sur: En el territorio Mágico y Ancestral del sur del departamento, se fusiona el patrimonio cultural y la biodiversidad natural, presentando lugares emblemáticos como el Parque Arqueológico de San Agustín, y una inigualable oferta de conexión con la naturaleza. Estos clústeres turísticos representan un paso significativo hacia la promoción del turismo sostenible en el Huila, ofreciendo a los huilenses y a los visitantes experiencias enriquecedoras que resaltan la belleza y la diversidad de esta región. La Gobernación del Huila, a través de la Secretaría de Desarrollo Económico y Turismo, invita a todos a explorar y disfrutar de estas fascinantes propuestas turísticas que enriquecen la oferta del departamento y promueven el desarrollo económico y cultural de sus habitantes. Clusteres turísticos 12/12/2023 Clusteres turísticos 12/12/2023 Clusteres turísticos 12/12/2023 Clusteres turísticos 12/12/2023 Clusteres turísticos 12/12/2023 Clusteres turísticos 12/12/2023 Clusteres turísticos 12/12/2023 Clusteres turísticos 12/12/2023 Clusteres turísticos 12/12/2023 Clusteres turísticos 12/12/2023 × Close Anterior Siguiente Clusteres turísticos Clusteres turísticos Clusteres turísticos Clusteres turísticos Clusteres turísticos Clusteres turísticos Clusteres turísticos Clusteres turísticos Clusteres turísticos Clusteres turísticos  "
Convocatoria del Fondo Mixto de Cultura del Huila  para la elección de Gerente,https://www.huila.gov.co/cultura-y-turismo/publicaciones/14567/convocatoria-del-fondo-mixto-de-cultura-del-huila-para-la-eleccion-de-gerente/,https://www.huila.gov.co/info/huila_bco/media/pubInt/thumbs/thpubInt_400X400_14567.webp,Ya está abierta la convocatoria pública para el proceso de selección de la terna que será presentada a la Junta Directiva del Fondo Mixto de Cultura del Huila (FOMCULTURA) para la elección del o la Ge,Última modificación11/12/2023,"Ya está abierta la convocatoria pública para el proceso de selección de la terna que será presentada a la Junta Directiva del Fondo Mixto de Cultura del Huila (FOMCULTURA) para la elección del o la Gerente del mismo. Neiva, 05 de diciembre de 2023. En las instalaciones de la Sala de Gobernadores ubicada en el segundo piso de la Gobernación del Huila se llevó a cabo la reunión del Consejo Departamental de Cultura, la cual contó con la participación presencial y virtual de gran parte de los consejeros de nuestro departamento, la presencia de la Secretaria de Cultura del Huila, Nelcy Tovar Trujillo, y  la delegada y representante de la Gobernación, Liliana Mercedes Vásquez Sandoval. Este espacio tuvo como principal objetivo la presentación del informe de gestión por parte de la secretaria Nelcy Tovar Trujillo, quien dio a conocer a través de una presentación detallada los logros y procesos realizados desde el sector cultural en el cuatrienio del gobierno Huila Crece a través de sus programas “Huila Crece en Cultura y con Enfoque Diferencial” y “Gestión, Protección y Salvaguardia del Patrimonio Cultural Huilense”. Dentro de los logros más destacados se encuentra el aumento en el recaudo de la Estampilla Pro-Cultura, realizada mediante la ordenanza 004 de 2021 por iniciativa del gobernador del Huila, la cual incrementó el recaudo por conceptos de contratos, convenios y adiciones de valor, pasando del 0.5% al 1.5%, lo que permitió aumentar más del 90% el presupuesto para el componente cultural de la Secretaría. También se encuentra la recuperación de la licencia de la Emisora Cultura La Huilense 95.3, la cual fue lograda a través de la resolución No. 04681 del 30 de diciembre de 2022, con el propósito de fortalecer la promoción e identidad cultural. Así mismo, se logró a través del proyecto de inversión en Formación el aporte a las Escuelas de Formación Artística y Cultural en áreas de Teatro, Música, Artes Visuales y Danzas, obteniendo una población beneficiada de 17.922 personas del área urbana y 5.967 del área rural, y la creación en el 2021 del importante semillero de talentos de la Banda Sinfónica Juvenil del Huila. También, se socializaron los logros en materia de Conservatorio Huilense de Música y Canto, aportes a la Banda Sinfónica del Huila, inversiones en el evento opita más representativo del Huila: el Festival del Bambuco de San Juan y San Pedro, el Encuentro Departamental de Cultura, la Biblioteca, el Fondo de Autores Huilenses, el innovador evento literario Filvorágine, el proyecto de Concertación y Estímulos, entre otros. Posterior al proceso de entrega de resultados y socialización de logros, los consejeros de cultura, la Secretaria de Cultura del Huila y la delegada del gobernador del Huila se dispusieron a realizar el documento de convocatoria pública que establece los términos y condiciones para la elección de la Terna, que será presentada a la Junta Directiva del Fondo Mixto de Cultura del Huila para la elección del o la Gerente del mismo. Este documento es acordado mediante el Acta No. 09 de 2023 y se compone de Fundamentos Jurídicos, Condiciones de Participación, Canales de Recepción de Documentos y Criterios de Evaluación. Dentro de las condiciones de participación se encuentra la presentación de una propuesta estratégica para el fortalecimiento del Fondo Mixto de Cultura y Turismo del Huila “FOMCULTURA”, el cumplimiento de las cualidades y requisitos de los aspirantes como Título profesional y especialización, estudios en Economía, Administración, Contaduría, Derecho o afines al objeto del Fondo, experiencia profesional mínima de diez (10) años, entre otros. Posterior al proceso de selección de la terna, se realizará un primer filtro con el Comité Evaluador, quienes verificarán el cumplimiento de los requisitos mínimos de los postulados, y definirán la lista de admitidos y no admitidos con su respectivo puntaje. Una vez cumplido este procedimiento, la Junta Directiva del Fondo Mixto revisará, evaluará y valorará las hojas de vida de los ternados y las propuestas presentadas, producto del cual se seleccionará la hoja de vida que será nombrado(a) gerente. Esta convocatoria pública está abierta desde el 04 de diciembre hasta el 06 de diciembre del presente año, su postulación puede realizarse de manera física en la Secretaría de Cultura del Departamento del Huila, ubicada en la Carrera 5 No. 21-81 Centro Cultural y de Convenciones en la ciudad de Neiva – Tercer Piso, en el horario comprendido de las 7:30 a.m. a 11:45 am y 2:00 pm a 5:00 p.m. O de manera digital al correo electrónico convocatoriafondomixto@gmail.com , sin exceder la hora de cierre de la presente convocatoria, siendo esta las 5:00 pm del día miércoles 6 de diciembre de 2023. Para más información de la convocatoria ingresar a: https://www.huila.gov.co/cultura-y-turismo/publicaciones/14554/consejo-dptalde-cultura-inicia-proceso-seleccion-terna-a-presentar-a-la-junta-directiva-para-la-eleccion-de-gerente-fomcultura/ "
