titulo,enlace,imagen,descripcion,fecha,contenido
"Banda Sinfónica del Huila: 120 de años de transformación, música e inspiración",https://www.huila.gov.co/cultura-y-turismo/publicaciones/16216/banda-sinfonica-del-huila-120-de-anos-de-transformacion-musica-e-inspiracion/,https://www.huila.gov.co/info/huila_bco/media/pub/thumbs/thpub_400X400_16216.webp,"En un acto de reconocimiento especial, con un viaje al pasado, la Secretaría de Cultura Departamental, llevó a cabo la conmemoración de los 120 años de creación de la Banda Sinfónica del Huila. El Gob",Última modificación28/08/2025,"En un acto de reconocimiento especial, con un viaje al pasado, la Secretaría de Cultura Departamental, llevó a cabo la conmemoración de los 120 años de creación de la Banda Sinfónica del Huila. El Gobernador Rodrigo Villalba, resaltó este importante certamen que enaltece uno de los emblemas más representativos de esta Tierra de Promisión. Neiva, 27 de agosto de 2025. Rememorando los momentos de surgimiento de la Banda Sinfónica del Huila, con imágenes que refrescaron en la mente lo que siempre ha mantenido unido al territorio, cerca de 700 asistentes vivieron un espectáculo majestuoso que tuvo como intención homenajear a esta escuela musical patrimonio cultural de los huilenses. Con la participación del gobernador del Huila, Rodrigo Villalba Mosquera, la duma departamental, el senador Carlos Julio González Villa y el alcalde de Neiva, Germán Casagua, se cumplió esta importante conmemoración organizada por la Secretaría de Cultura del Departamento, que orienta María Liliana Quimbaya Bahamón. La historia de la Banda Sinfónica se remonta a finales del siglo XIX y comienzos del XX, cuando pequeñas agrupaciones musicales empezaban a formarse en Neiva y en distintos municipios del Huila. Eran parte de las fiestas religiosas, de los actos cívicos, de las celebraciones populares. “Hoy celebramos la creación de la institución cultural más antigua de nuestro departamento, un símbolo vivo que ha sabido mantenerse de pie durante más de un siglo, fiel a su esencia, renovada con cada generación, y siempre al servicio del arte, de la tradición y de la identidad de los huilenses”, destacó el gobernador del Huila, Rodrigo Villalba Mosquera. “La Banda Sinfónica del Huila nació el 1 de julio de 1905, apenas 16 días después de la creación administrativa del departamento del Huila. Su fundación fue oficializada mediante el Decreto No 30 del primer gobernador Rafael Puyo Perdomo. Fue llamada inicialmente “Banda Departamental de Músicos del Huila”, con el maestro Milcíades “Chato” Durán como director titular y solo 14 músicos integrándola”, rememoró el mandatario departamental. Patrimonio Cultural La Banda Sinfónica del Huila fue declarada Patrimonio Cultural de todos los huilenses en el año 2003, mediante el Decreto 1080 y ha sido una organización invitada al Palacio de Nariño en la era de Virgilio Barco, alcanzando reconocimiento nacional y obteniendo dos veces el segundo lugar en Corbandas, el concurso nacional de bandas en Paipa (2004 y 2006). “La Banda Sinfónica es también una escuela de vida. De aquí han salido generaciones de músicos que hoy integran orquestas nacionales e internacionales, que han hecho doctorados en universidades de gran prestigio en Estados Unidos, o que han tenido la oportunidad de dirigir agrupaciones en escenarios europeos. ¡Qué orgullo para el Huila saber que de nuestras tierras surgen talentos que conquistan el mundo!. Hoy también quiero rendir un merecido homenaje a los maestros que, con su talento y entrega, han hecho posible este legado”, manifestó Villalba Mosquera. “Hoy recordamos al maestro Milcíades “Chato” Durán, primer director desde la fundación en 1905, y a quienes siguieron sus pasos con brillantez: Jorge Durán Plazas, Anselmo Durán Plazas —autor de la música de nuestro Sanjuanero Huilense—, Carlos Enrique Cortés Quiroga —creador de piezas memorables como La Cortesana y La Guabina Huilense—, y Abel Valderrama Yusti, pedagogo incansable que durante casi 40 años condujo esta agrupación con disciplina y pasión”, aseguró el gobernador. Al principio esta organización musical dependía de la Secretaría de Gobierno, y más tarde pasó por la Policía Nacional, vistiendo uniformes militares; en los años 50 se vinculó a la Secretaría de Educación y en 1974 pasó a depender del Instituto Huilense de Cultura. “Desde entonces, la Banda Sinfónica ha sido protagonista de nuestra vida cultural: en los desfiles, en los festivales, en las fiestas de San Juan y San Pedro, también ha estado presente en los escenarios más importantes de Colombia, como el Teatro Colón, el Jorge Eliécer Gaitán y el Julio Mario Santo Domingo, llevando con orgullo los sonidos de nuestra tierra”, continuó el gobernador del Huila. Los últimos directores En tiempos más recientes, varios reconocidos directores han sido los embajadores musicales al frente de la Banda Sinfónica del huila, como Constantino Silva, Rafael Serrano Barceló, John Jairo Sandoval Ruiz, Pedro Dussán Salazar y Pablo Andrés Suárez Escobar. Cada uno dejó huella y fortaleció el camino. Hoy, bajo la dirección del maestro artístico Wilder de Jesús Román Grisales, la Banda mantiene su esencia folclórica, combinada con un rigor académico que la proyecta al futuro con más fuerza y autenticidad. “Hoy, desde este escenario, no solo celebramos el pasado glorioso de la Banda, sino que reafirmamos nuestro compromiso como Gobierno Departamental de apoyar su presente y su futuro. Porque una sociedad que respalda su música y a sus músicos, es una sociedad que cree en su gente, que cree en su cultura y en su futuro. En nombre de todos los huilenses, feliz aniversario número 120 a nuestra Banda Sinfónica del Huila y que sigan siendo orgullo regional, escuela de vida, y símbolo de lo que somos como pueblo”, concluyó el gobernador Rodrigo Villalba. “Una hermosa celebración que quedará para la Historia” Anyela Zulima Cortés Cárdenas, quien interpreta el trombón y con 22 años de ser integrante de la Banda Sinfónica del Departamento, ofreció unas palabras en nombre de esta prestigiosa organización musical y cultural de los huilenses. “Muchas gracias por este homenaje. En nombre de mis compañeros de la banda, agradecemos a Dios, al gobernador Rodrigo Villalba, a nuestra Secretaria de Cultura Departamental, María Liliana Quimbaya Bahamón, y a todos los actores institucionales que hicieron parte de esta gran conmemoración”, señaló la artista. “Será una hermosa celebración que quedará en la historia del Huila. A ustedes público huilense, por ustedes estamos aquí. Hoy todos somos la banda sinfónica del departamento”, complementó. Conmemoraron 120 años Banda Sinfónica Huila 28/08/2025 Conmemoraron 120 años Banda Sinfónica Huila 28/08/2025 Conmemoraron 120 años Banda Sinfónica Huila 28/08/2025 Conmemoraron 120 años Banda Sinfónica Huila 28/08/2025 Conmemoraron 120 años Banda Sinfónica Huila 28/08/2025 Conmemoraron 120 años Banda Sinfónica Huila 28/08/2025 Conmemoraron 120 años Banda Sinfónica Huila 28/08/2025 Conmemoraron 120 años Banda Sinfónica Huila 28/08/2025 Conmemoraron 120 años Banda Sinfónica Huila 28/08/2025 Conmemoraron 120 años Banda Sinfónica Huila 28/08/2025 × Close Anterior Siguiente Conmemoraron 120 años Banda Sinfónica Huila Conmemoraron 120 años Banda Sinfónica Huila Conmemoraron 120 años Banda Sinfónica Huila Conmemoraron 120 años Banda Sinfónica Huila Conmemoraron 120 años Banda Sinfónica Huila Conmemoraron 120 años Banda Sinfónica Huila Conmemoraron 120 años Banda Sinfónica Huila Conmemoraron 120 años Banda Sinfónica Huila Conmemoraron 120 años Banda Sinfónica Huila Conmemoraron 120 años Banda Sinfónica Huila  "
Secrecultura y gestores culturales trabajan en la preparación del Festival del Bambuco en 2026,https://www.huila.gov.co/cultura-y-turismo/publicaciones/16214/secrecultura-y-gestores-culturales-trabajan-en-la-preparacion-del-festival-del-bambuco-en-2026/,https://www.huila.gov.co/info/huila_bco/media/pub/thumbs/thpub_400X400_16214.webp,La Secretaría de Cultura del Huila realizó una serie de talleres con los gestores culturales del departamento para analizar los puntos de mejora del Festival del Bambuco en San Juan y San Pedro del 20,Última modificación28/08/2025,"La Secretaría de Cultura del Huila realizó una serie de talleres con los gestores culturales del departamento para analizar los puntos de mejora del Festival del Bambuco en San Juan y San Pedro del 2025 con miras a realizar ajustes para la versión 65 del año entrante. Neiva, 27 de agosto de 2025. Los gestores culturales de distintos municipios y de diversas artes del Huila participaron de un taller para realizar un balance sobre diversos aspectos que podrían ser considerados como oportunidades de mejora en lo concerniente a la organización y realización del Festival del Bambuco en San Juan y San Pedro. “Ofrecimos estos espacios porque es con los gestores culturales como debemos llevar a cabo el balance de nuestras fiestas. Este ciclo de talleres fue convocado por nuestra secretaría y dirigido a los gestores que participaron del festival en el presente año. Estuvieron presentes gestores de los oficios y artes de la música, comparsas, danzas, bandas, y logramos escuchar sus inquietudes”, resaltó María Liliana Quimbaya, Secretaria de Cultura del Huila. “Recibimos varias sugerencias y recomendaciones de estos actores importantes de nuestra cultura huilense. Son ellos los autores de muchos aspectos positivos de nuestras festividades durante muchos años y sin los cuales no tendríamos un festival de mostrar en todos los escenarios artísticos”, complementó. Por su parte, Adriana Artunduaga, Consejera Municipal de la ciudad de Neiva en el arte de la Danza, afirmó que esta vinculación al taller sirvió para hacer una retroalimentación de lo que ha sido el festival en su historia. “Estas mesas son muy importantes porque esto es una construcción colectiva durante mucho tiempo de lo que han sido nuestras fiestas. De modo que es necesario que unamos esfuerzos para mejorar el festival en el 2026 que implique un trabajo mancomunado entre gestores culturales y la institucionalidad”, destacó. Entre tanto, el parejo profesional del sanjuanero, Jairo Moya, reconoció lo indispensable de estos escenarios insistiendo en que hay muchas cosas por mejorar en las fiestas que tanto representan al Huila en el país y ante el mundo. “Evaluar es importante para mejorar. Y bastante nos hace falta mejorar en asuntos de organización del festival. Por ejemplo, en el tema del parejo del sanjuanero, hace falta más capacitación, formación, un mejor proceso de selección. Parejo no es sólo el que se sube a la tarima a bailar, sino también el que forma a la candidata, en el baile, pero además en toda la manifestación cultural del sanjuanero, con la artesanía y todo lo que rodea a nuestras fiestas”, manifestó. Talleres con Gestores Culturales 28/08/2025 Talleres con Gestores Culturales 28/08/2025 Talleres con Gestores Culturales 28/08/2025 Talleres con Gestores Culturales 28/08/2025 × Close Anterior Siguiente Talleres con Gestores Culturales Talleres con Gestores Culturales Talleres con Gestores Culturales Talleres con Gestores Culturales "
El Huila conmemora una fecha histórica: 120 años de la Banda Sinfónica del Huila,https://www.huila.gov.co/cultura-y-turismo/publicaciones/16200/el-huila-conmemora-una-fecha-historica-120-anos-de-la-banda-sinfonica-del-huila/,https://www.huila.gov.co/info/huila_bco/media/pub/thumbs/thpub_400X400_16200.webp,La Secretaría de Cultura Departamental conmemorará los 120 de años de creación de uno de los emblemas culturales más importantes para los huilenses.,Última modificación27/08/2025,"La Secretaría de Cultura Departamental conmemorará los 120 de años de creación de uno de los emblemas culturales más importantes para los huilenses. Neiva, 26 de agosto de 2025. Este miércoles 27 de agosto, la Secretaría de Cultura del Huila, que orienta María Liliana Quimbaya Bahamón, realizará un merecido homenaje a la Banda Sinfónica del Huila que cumple 120 años de creada. Esta organización musical fue creada el 1 de julio de 1905, mediante el Decreto N°30, al mismo tiempo que se establecía el ente territorial del departamento del Huila. Su primer director fue el maestro Milcíades ""El Chato"" Durán, y sus primeras melodías empezaron a engalanar al Huila junto a 14 músicos. Hoy, la banda Sinfónica del Huila cuenta con 40 concertistas. “Será un homenaje por todo lo alto este miércoles 27 de agosto a partir de las 5 pm en la plaza de banderas de la Gobernación del Huila. Con actividades culturales especiales hemos querido realizar este merecidísimo acto de reconocimiento a nuestra banda, que tanto le ha aportado al fortalecimiento de la identidad opita en Colombia y el mundo”, expresó la secretaria de cultura. “Este tipo de homenaje a nuestros patrimonios culturales contribuyen a la construcción de una cultura de sentido de pertenencia por lo que nos hace grandes en los escenarios artísticos y culturales. Son muchos los conciertos que nos han engalanado en diversos escenarios de la cultura con la presencia de nuestra banda sinfónica y era justo llevar a cabo esta conmemoración que pone en alto nuestro ser huilense”, complementó. La funcionaria también recordó que la banda sinfónica ha sido la escuela musical por la que muchos huilenses han pasado y han dejado huella en el alma de la huilensidad. Banda Sinfónica del Huila 27/08/2025 Banda Sinfónica del Huila 27/08/2025 Banda Sinfónica del Huila 27/08/2025 Banda Sinfónica del Huila 27/08/2025 Banda Sinfónica del Huila 27/08/2025 × Close Anterior Siguiente Banda Sinfónica del Huila Banda Sinfónica del Huila Banda Sinfónica del Huila Banda Sinfónica del Huila Banda Sinfónica del Huila"
"Más de 3.000 niños, niñas y jóvenes del Huila serán formados en danza, música, teatro y artes visuales",https://www.huila.gov.co/cultura-y-turismo/publicaciones/16173/mas-de-3000-ninos-ninas-y-jovenes-del-huila-seran-formados-en-danza-musica-teatro-y-artes-visuales/,https://www.huila.gov.co/info/huila_bco/media/pub/thumbs/thpub_400X400_16173.webp,"Se realizó el lanzamiento oficial de las Escuelas de Formación Cultural y Artística bajo la coordinación de la Secretaría de Cultura del Huila. A la apertura oficial de este programa, que se llevó a c",Última modificación21/08/2025,"Se realizó el lanzamiento oficial de las Escuelas de Formación Cultural y Artística bajo la coordinación de la Secretaría de Cultura del Huila. A la apertura oficial de este programa, que se llevó a cabo en la biblioteca Olegario Rivera, asistieron los talleristas que formarán a los menores en las casas de la cultura y en las instituciones educativas de los municipios. Neiva, 20 de agosto de 2025. “La cultura y el arte están de fiesta. Vamos a aportarle al Huila, una formación de 4 meses para que nuestros menores, se conviertan en portadores de nuestras propias raíces culturales, porque queremos preservar lo que nos hace grandes en todo el mundo”, resaltó la Secretaria de Cultura Departamental, María Liliana Quimbaya Bahamón. El lanzamiento oficial de este programa, de Escuelas de Formación Cultural y Artística, promete capacitar mediante talleres a niños, niñas y adolescentes en los 37 municipios del territorio huilense, entre el 20 de agosto y el 20 de diciembre del 2025. En Neiva la apertura oficial fue el 20 del presente mes y en Pitalito, será el jueves 21. “El propósito es promover nuestras artes, nuestras manifestaciones culturales, nuestros saberes, en los oficios de danza, música, teatro y artes visuales. Sembrar futuro en nuestros niños y niñas de las instituciones educativas del departamento y de los municipios del huila, es propósito del gobernador Rodrigo Villalba Mosquera”, complementó la secretaria. En cumplimiento de la Ordenanza 030 de 2009, este programa en la presente vigencia, tendrá a 85 beneficiarios por cada municipio, y unos 450 sólo en Neiva, es decir cerca de 3.500 beneficiarios de este programa en todo el departamento del Huila. “Ya son 17 años que el gobierno departamental viene llevando a cabo estas formaciones ininterrumpidamente a la infancia y juventud huilense. Para este año, los cerca de 160 talleristas deben desarrollar 120 horas en estos próximos 4 meses de capacitación. El programa contempla que serán 30 estudiantes en Danza, 20 en música, 20 en teatro y 15 en artes visuales en cada municipio. Para este último oficio, se incluye la dotación de un kit para cada niño, niña o adolescente (óleos, pinturas, pinceles)”, explicó María Liliana Quimbaya. Preservar el patrimonio cultural huilense “El propósito de este programa es preservar el patrimonio cultural de los huilenses. Es luchar desde la resistencia cultural, a toda esa oferta que proviene de la globalización, esa interconexión a través del internet y las redes sociales que muchas veces dejan en un segundo plano a nuestras expresiones artísticas, autóctonas y tradicionales de la región. Es darles importancia a las raíces y al folclor propio"", manifestó la Secretaria de Cultura. “Sólo en Neiva se contará con 10 talleristas en danza y otros 10 en las otras áreas, con los que se aspira a formar a cerca de 450 estudiantes y participantes de los talleres. Los beneficiarios generalmente son de 5 años de edad en adelante, hasta los jóvenes. Pero hemos tenido casos en los que del sector rural han participado adultos y adultos mayores en este programa. Sin embargo, la población mayoritaria siempre han sido niños, niñas y adolescentes”, complementó. Inscripciones e inversión del Departamento El proceso de inscripción a estos talleres se lleva a cabo a través de una convocatoria que realizan las casas de la cultura en cada uno de los municipios del huila, y también a través de las instituciones educativas. El proceso de inscripción es con cada tallerista que visita los centros educativos y mediante anuncios por los medios de comunicación, así como por las páginas virtuales y en redes sociales de los distintos municipios. La inversión que hace el gobierno Huila Grande para este programa de Escuelas de Formación Artística y Cultural, en este año, alcanza los $944 millones que se destina a varios ítems, como son los honorarios de los talleristas, kits para los participantes de los talleres de artes visuales, encuentro de cultura central, y 10 eventos al finalizar las capacitaciones formativas, momento en que coincidirán con las novenas de aguinaldo en época de navidad. “Espacios Culturales para engrandecer al Huila” René Fernando Betancourt, instructor artístico para el municipio de Gigante, uno de los asistentes al lanzamiento, afirmó que estos espacios que lidera la Secretaría de Cultura Departamental, se convierten en importantes espacios para hacer grande lo que representa al Huila. “El arte y la cultura, nos permiten ser huilenses con sello propio en cualquier parte del mundo. Como maestros de estos oficios, en mi caso de Teatro, daremos lo mejor de nuestros conocimientos para formar a estos niños en los próximos 4 meses. Sé que el gobernador del Huila, Rodrigo Villalba Mosquera, le apuesta a fortalecer nuestra identidad cultural y por eso estos talleres que permiten precisamente rescatar lo que nos hace grandes en el mundo”, expresó. Lanzan Escuelas de Formación Artistica 21/08/2025 Lanzan Escuelas de Formación Artistica 21/08/2025 Lanzan Escuelas de Formación Artistica 21/08/2025 Lanzan Escuelas de Formación Artistica 21/08/2025 × Close Anterior Siguiente Lanzan Escuelas de Formación Artistica Lanzan Escuelas de Formación Artistica Lanzan Escuelas de Formación Artistica Lanzan Escuelas de Formación Artistica "
Recibidas 71 obras literarias en el Concurso Departamental de Literatura del Huila,https://www.huila.gov.co/cultura-y-turismo/publicaciones/16170/recibidas-71-obras-literarias-en-el-concurso-departamental-de-literatura-del-huila/,https://www.huila.gov.co/info/huila_bco/media/pub/thumbs/thpub_400X400_16170.webp,"Un total de 71 trabajos literarios recibió la Secretaría de Cultura Departamental, al cierre de la convocatoria al Concurso Departamental de Literatura, que inició el 21 de julio y cerró el pasado vie",Última modificación20/08/2025,"Un total de 71 trabajos literarios recibió la Secretaría de Cultura Departamental, al cierre de la convocatoria al Concurso Departamental de Literatura, que inició el 21 de julio y cerró el pasado viernes 15 de agosto. Neiva, 20 de agosto de 2025. El Huila se alista para conocer a los ganadores del Concurso Departamental de Literatura que organiza la Secretaría de Cultura del Huila, en las modalidades de Cuento, Ensayo, Dramaturgia y Poesía, luego de la reciente convocatoria organizada por la Secretaría de Cultura del Huila, una convocatoria que se viene realizando anualmente desde el año 1998 en el departamento. “Fue una convocatoria exitosa. Vamos a seguir fortaleciendo e incentivando el valioso arte de escribir de los huilenses. El gran número de participantes revela que sí recibieron con gran expectativa este concurso que realizamos en esta versión en el territorio departamental”, expresó la Secretaria de Cultura del Huila, María Liliana Quimbaya Bahamón. “Daremos a conocer los nombres de los ganadores durante el desarrollo de la tercera versión de Filvorágine, a desarrollarse entre el 11 y el 14 de septiembre del presente año. Esta es una cita con las letras, con la producción intelectual de nuestros escritores, con las narrativas que aportan mucho a nuestra cultura huilense”, destacó la funcionaria. Los trabajos recibidos Fueron en total, 71 trabajos escritos que clasificaron en la convocatoria cumpliendo todas las condiciones normativas establecidas y que corresponden a las siguientes categorías: Modalidad de Poesía “José Eustasio Rivera”: 27 Modalidad de Cuento “Humberto Tafur Charry”: 37 Modalidad de Ensayo “Jenaro Díaz Jordán”: 3 Modalidad de Dramaturgia “Gustavo Andrade Rivera”: 4 El concurso oficialmente abrió postulaciones desde el 21 de julio y cerró el viernes 15 de agosto a las 12 del mediodía como estaba establecido en los términos de la convocatoria, en cumplimiento a los postulados de la Constitución Nacional, y que busca fortalecer las acciones culturales en garantía del acceso de los ciudadanos a las diversas formas de expresión artística, entre las cuales se resalta la literatura. “En ese sentido, en el año 1993 se instituyeron los Concursos Literarios para estimular la creación de los autores huilenses a través de un incentivo económico que, a su vez, ha posicionado y galardonado a escritores que hoy en día son orgullo de la cultura huilense, que igualmente, han posibilitado la formación de un sólido grupo de escritores que hoy por hoy, hacen de la Literatura Huilense una realidad en el contexto nacional”, estipula la convocatoria. Los incentivos económicos Para cada modalidad, la premiación consiste en un incentivo económico de $3’000.000 para el primer puesto, y de $2’000.000 para el segundo puesto. La selección de los ganadores en cada modalidad, estará a cargo de un jurado conformado por 3 personas de reconocida idoneidad en el medio literario. Sus nombres solo se divulgarán el día del fallo."
