titulo,enlace,imagen,descripcion,fecha,contenido
Convocatoria para el diseño del Afiche Oficial del 64° Festival del Bambuco en San Juan y San Pedro 2025: Una oportunidad para plasmar la esencia cultural del Huila,https://www.huila.gov.co/cultura-y-turismo/publicaciones/15499/convocatoria-para-el-diseno-del-afiche-oficial-del-64-festival-del-bambuco-en-san-juan-y-san-pedro-2025-una-oportunidad-para-plasmar-la-esencia-cultural-del-huila/,https://www.huila.gov.co/info/huila_bco/media/pub/thumbs/thpub_400X400_15499.webp,"Es una oportunidad única para contribuir a la promoción y difusión de una de las celebraciones más emblemáticas del sur del país, reconocida como patrimonio cultural inmaterial de Colombia.",Última modificación02/02/2025,"Es una oportunidad única para contribuir a la promoción y difusión de una de las celebraciones más emblemáticas del sur del país, reconocida como patrimonio cultural inmaterial de Colombia. Neiva, 28 de enero de 2025. El próximo 31 de enero cierra la convocatoria habilitada por la Gobernación del Huila y la Alcaldía de Neiva, en su compromiso por fortalecer las tradiciones culturales de la región. El objetivo es seleccionar el afiche oficial de la 64° edición del Festival del Bambuco en San Juan y San Pedro 2025. Este certamen busca capturar, a través del diseño gráfico, la riqueza artística, folclórica y simbólica que define esta festividad. Cabe recordar que la convocatoria está dirigida a diseñadores gráficos, artistas plásticos, publicistas y creativos con residencia en el Huila o con un vínculo demostrable con el territorio. Los participantes tendrán la oportunidad de presentar propuestas que reflejen la identidad cultural del departamento, integrando elementos como la música, la danza, el Río Magdalena y la mitología regional, en una pieza gráfica que combine impacto visual, originalidad y versatilidad. El afiche ganador no solo será la imagen oficial del festival, sino que también servirá como herramienta de promoción a nivel nacional e internacional, destacando la importancia de esta celebración en la preservación de las tradiciones huilenses. Además, el autor de la propuesta seleccionada recibirá un estímulo económico de $8.000.000, junto con el reconocimiento de haber contribuido a la difusión de una de las fiestas más sobresalientes de Colombia. Los interesados deberán cumplir con los requisitos establecidos en la convocatoria, entre los que se incluyen la presentación de una propuesta inédita, la entrega de documentos legales y la aceptación de las condiciones de participación. “El jurado calificador, integrado por expertos en diseño y cultura, evaluará las propuestas bajo criterios de calidad gráfica, pertinencia cultural y capacidad comunicativa. El 31 de enero se les entregarán las propuestas y el día 10 de febrero daremos a conocer al departamento el ganador o la ganadora”, afirmó Betsabé Polania Quiza, secretaria de cultura del Huila. Esta convocatoria representa una oportunidad única para que los talentos creativos del Huila dejen su huella en la historia del Festival del Bambuco, contribuyendo a la promoción y preservación de una tradición que une a los opitas en torno a la música, la danza y la alegría colectiva. Para más información pueden visitar: https://acortar.link/0EmmGR Visualizar 0.45MB Nombre CONVOCATORIA AFICHE 2025 .pdf Descripción Convocatoria afiche sanpedro 2025 Categoría Convocatoria afiche sanpedro 2025 Tipo de documento Convocatorias Fechas Expedición: 02/02/2025 Publicación: 02/02/2025"
"“Gobernamos un Huila potenciando su desarrollo como modelo en el país”, Rodrigo Villalba en rendición de cuentas",https://www.huila.gov.co/cultura-y-turismo/publicaciones/15441/gobernamos-un-huila-potenciando-su-desarrollo-como-modelo-en-el-pais-rodrigo-villalba-en-rendicion-de-cuentas/,https://www.huila.gov.co/info/huila_bco/media/pub/thumbs/thpub_400X400_15441.webp,"El Gobierno que lidera Rodrigo Villalba Mosquera, recibió un departamento siendo primero en distintos renglones socio económicos y productivos. Hoy se enfocan sus esfuerzos en continuar en las primera",Última modificación16/12/2024,Rendición de Cuentas 2024 Rendición de Cuentas 2024 Rendición de Cuentas 2024
Huilenses vivieron fiesta cultural con el IV Festival Internacional de Teatro,https://www.huila.gov.co/cultura-y-turismo/publicaciones/15430/huilenses-vivieron-fiesta-cultural-con-el-iv-festival-internacional-de-teatro/,https://www.huila.gov.co/info/huila_bco/media/pub/thumbs/thpub_400X400_15430.webp,"El Festival Internacional de Teatro, una destacada iniciativa cultural liderada por la Gobernación del Huila a través de la Secretaría Departamental de Cultura, concluyó con éxito su cuarta edición, r",Última modificación12/12/2024,"El Festival Internacional de Teatro, una destacada iniciativa cultural liderada por la Gobernación del Huila a través de la Secretaría Departamental de Cultura, concluyó con éxito su cuarta edición, realizada del 2 al 6 de diciembre. Este evento reafirma el compromiso del departamento con el fortalecimiento de las artes escénicas y la promoción cultural en toda la región. Neiva, 11 de diciembre de 2024. El festival se llevó a cabo en los municipios de Neiva, Hobo, Algeciras, Íquira e Isnos, logrando convocar a cerca de 5.000 asistentes. La programación incluyó 18 obras teatrales de gran calidad y cuatro talleres de formación artística, que contaron con una notable asistencia y participación de público entusiasta, desde niños y jóvenes hasta familias completas, quienes disfrutaron de una experiencia única alrededor del arte y la cultura. La secretaría de Cultura del departamento, Betsabé Polanía, destacó la importancia de que los huilenses sigan apoyando y participando activamente en espacios culturales como el Festival Internacional de Teatro. “En esta cuarta versión tuvimos una excelente participación. Seguiremos trabajando para fortalecer los procesos teatrales en el Huila, con el objetivo de que este festival se consolide año tras año y siga creciendo”, expresó. En Neiva, los principales escenarios del festival incluyeron el Teatro Pigoanza, salas de teatro locales y centros comerciales, que vibraron con la diversidad de propuestas artísticas presentadas. Este año, el festival ganó aún más aceptación entre los huilenses, quienes valoraron la existencia de espacios que fomentaron el uso creativo del tiempo libre y promueven la transformación social a través del arte. Entre los asistentes, Luisa Gutiérrez, participante del taller de títulos, compartió su experiencia: “Estoy muy feliz y complacida con este taller de esparcimiento cultural. Gracias por brindarnos estos espacios; invitamos a todos los huilenses a sumarse a estas iniciativas y disfrutar de la amplia oferta cultural que nos ofrece la Secretaría de Cultura”. Los talleres de formación, diseñados para fortalecer los procesos artísticos y teatrales en la región, también fueron un rotundo éxito. Atrajeron a artistas locales ya un público diverso, evidenciando el interés por el desarrollo cultural en el departamento. La clausura del festival estuvo marcada por la presentación de El lobo, del grupo Los Animistas Teatro de Bogotá. La obra conmovió profundamente al público con una puesta en escena que aborda la memoria histórica, destacando los efectos de la violencia en las comunidades campesinas. Esta representación dejó una reflexión sobre la importancia del arte para narrar, sanar y preservar la memoria. El docente Emilio Polo Ledesma, de la Universidad Surcolombiana y apasionado del teatro, resaltó la relevancia del festival y de obras como El lobo: “Estoy muy emocionado. Hace mucho tiempo no tuve una oportunidad como esta. El teatro debe llevarse a las escuelas, a las instituciones educativas y seguir impulsándose desde escenarios como este, que fortalecen y construyen desde el arte”. El Festival Internacional de Teatro continúa posicionándose como un evento cultural emblemático en el Huila, demostrando que el arte es una herramienta poderosa para la transformación y la cohesión social. Finalizó encuentro internacional teatro 12/12/2024 Finalizó encuentro internacional teatro 12/12/2024 Finalizó encuentro internacional teatro 12/12/2024 Finalizó encuentro internacional teatro 12/12/2024 × Close Anterior Siguiente Finalizó encuentro internacional teatro Finalizó encuentro internacional teatro Finalizó encuentro internacional teatro Finalizó encuentro internacional teatro "
Gala de Prefestival exalta 63 años de tradición cultural en el Huila,https://www.huila.gov.co/cultura-y-turismo/publicaciones/15421/gala-de-prefestival-exalta-63-anos-de-tradicion-cultural-en-el-huila/,https://www.huila.gov.co/info/huila_bco/media/pub/thumbs/thpub_400X400_15421.webp,"En el teatro Pigoanza de la ciudad de Neiva, se llevó a cabo la gala de prefestival del Bambuco en San Juan y San Pedro 2025. El Gobierno Departamental exaltó la labor de actores que han enriquecido l",Última modificación10/12/2024,"En el teatro Pigoanza de la ciudad de Neiva, se llevó a cabo la gala de prefestival del Bambuco en San Juan y San Pedro 2025. El Gobierno Departamental exaltó la labor de actores que han enriquecido las festividades durante su historia. Neiva, 10 de diciembre de 2024. En una gala especial, la Secretaría Departamental de Cultura, destacó a quienes han enriquecido el Festival del Bambuco en San Juan y San Pedro en estos 63 años de tradición. Gestores culturales, artistas, agrupaciones folclóricas, fundaciones, reinas, parejos, niños y patrocinadores, fueron exaltados por el importante aporte que han realizado por la cultura del departamento. “Celebramos con orgullo y alegría la gala de uno de los eventos más importantes no sólo del Huila, sino de Colombia. Nos reunimos aquí para exaltar lo mejor de nuestras fiestas, aquellas que no sólo representan el alma del Huila, sino también el espíritu cultural que nos une como colombianos. Nuestro festival es una de las expresiones artísticas más representativas de nuestro país, y su impacto va más allá de los escenarios culturales” dijo Camilo Lozano, gobernado encargado del Huila. En cuanto al impacto que general que genera las tradiciones fiestas de San Juan y San Pedro en el Huila, el funcionario recalcó. “Este festival se ha consolidado como un motor clave para nuestra economía, movilizando sectores como el turismo, la gastronomía, las artesanías y el comercio hotelero, beneficiando de manera directa e indirecta a miles de familias huilenses” enfatizó. Anuncios importantes Desde ya se está trabajando en el festival del Bambuco en San Juan y San Pedro 2025, con el cual se busca seguir rescatando las tradiciones. La Secretaría de Cultura indicó que pronto abrirán la convocatoria pública para la elección del afiche. Además, aquellos gestores culturales que participaron en la convocatoria pública de estímulos 2024, de la Secretaría de Cultura, fueron reconocidos con un incentivo económico. “Hemos desarrollado una actividad en reconocimiento a los gestores culturales y artistas del departamento del Huila, que clasificaron en el marco del festival del bambuco de este año. Reconocimos aquellas puestas en escena teatrales, musicales y de danzas, donde clasificaron los 10 mejores grupos, quienes fueron galardonados. Aquellos que participaron en la convocatoria pública de estímulos 2024, fueron premiados con $129 millones para las 30 personas que clasificaron en dicha convocatoria del mes pasado” agregó Betsabé Polanía Quiza, secretaria de cultura del Huila. Gala Prefestival 10/12/2024 Gala Prefestival 10/12/2024 Gala Prefestival 10/12/2024 × Close Anterior Siguiente Gala Prefestival Gala Prefestival Gala Prefestival "
El Huila celebró 100 años de La Vorágine,https://www.huila.gov.co/cultura-y-turismo/publicaciones/15375/el-huila-celebro-100-anos-de-la-voragine/,https://www.huila.gov.co/info/huila_bco/media/pub/thumbs/thpub_400X400_15375.webp,"Con actos culturales, artísticos y una agenda académica especial, la Gobernación del Huila conmemoró el centenario de La Vorágine del escritor José Eustasio Rivera. La Banda Sinfónica deleitó al públi",Última modificación26/11/2024,"Con actos culturales, artísticos y una agenda académica especial, la Gobernación del Huila conmemoró el centenario de La Vorágine del escritor José Eustasio Rivera. La Banda Sinfónica deleitó al público con una composición única alrededor de esta obra reconocida mundialmente. Neiva, 25 de noviembre de 2024. La Secretaría de Cultura Departamental conmemoró los 100 años de La Vorágine. En el año 1924, el escritor huilense José Eustasio Rivera, hizo la publicación de este libro, el cual le ha dado la vuelta al mundo. Ha sido traducida a más de 20 idiomas, facilitando su lectura a los fanáticos de la buena literatura, cautivando la atención de todo tipo de públicos. “Como Gobernador del Huila, me alegra en el alma haber podido generar esta conmemoración de los 100 años de publicación de esta obra maestra de la literatura colombiana como lo es La Vorágine del compositor huilense José Eustasio Rivera. Hay unas cosas que hay que hacer en el desarrollo de la ley, como es el museo, revisar otras en el departamento y en el país. Yo creo que lo primero que debemos hacer es estar en línea con el espíritu de la ley La Vorágine, y seguir trabajando en el legado de Rivera” aseguró Rodrigo Villalba Mosquera, Gobernador del Huila. Durante la celebración que se llevó a cabo en la Biblioteca Olegario Rivera, se presentó oficialmente, la obra musical magistral a cargo de la Banda Sinfónica del Huila, Suite La Vorágine, la cual sumergió a los asistentes en la travesía literaria que hizo el escritor para la producción esta pieza icónica que ha sido leída en gran parte del mundo. “Hicimos reconocimientos a instituciones y personajes que han hecho importantes aportes a La Vorágine durante muchos años y hoy quisimos reconocerles ese trabajo literario. Posterior a eso, tuvimos un conversatorio con Norma Donatto, y con Carlos Páramo y el escritor huilense Isaías Peña” dijo la secretaria de Cultura, Betsabé Polanía. Seguidamente manifestó “Esto es cultura, es un concepto amplio que tenemos nosotros a través de la literatura y el reconocimiento a los escritores que fueron exaltados” puntualizó Polanía. Teatro La Vorágine Artistas locales participaron en una gran obra de teatro que se hizo en torno a esta obra literaria. En la plazoleta del Centro de Convenciones, José Eustasio Rivera, en una puesta en escena se recreó La Vorágine, dándole vida a los personajes, situaciones y lugares que ilustran la obra. El Gobierno por un “Huila Grande” manifestó la emoción de poder conmemorar esta importante fecha para una obra destacada de la literatura colombiana. 100 Años de La Vorágine 26/11/2024 100 Años de La Vorágine 26/11/2024 100 Años de La Vorágine 26/11/2024 100 Años de La Vorágine 26/11/2024 100 Años de La Vorágine 26/11/2024 100 Años de La Vorágine 26/11/2024 100 Años de La Vorágine 26/11/2024 100 Años de La Vorágine 26/11/2024 100 Años de La Vorágine 26/11/2024 × Close Anterior Siguiente 100 Años de La Vorágine 100 Años de La Vorágine 100 Años de La Vorágine 100 Años de La Vorágine 100 Años de La Vorágine 100 Años de La Vorágine 100 Años de La Vorágine 100 Años de La Vorágine 100 Años de La Vorágine "
Centenario de La Vorágine se celebrará por lo alto en el Huila,https://www.huila.gov.co/cultura-y-turismo/publicaciones/15368/centenario-de-la-voragine-se-celebrara-por-lo-alto-en-el-huila/,https://www.huila.gov.co/info/huila_bco/media/pub/thumbs/thpub_400X400_15368.webp,"Con una amplia programación el Gobierno Departamental conmemorará los 100 años de publicación de La Vorágine escrita por José Eustasio Rivera. En el municipio donde nació el autor, también hay program",Última modificación22/11/2024,"Con una amplia programación el Gobierno Departamental conmemorará los 100 años de publicación de La Vorágine escrita por José Eustasio Rivera. En el municipio donde nació el autor, también hay programación especial. Neiva, 22 de noviembre de 2024. Con un agenda académica, actos musicales, culturales y entrega de reconocimientos, así se desarrollará la conmemoración de los 100 años de publicación de La Vorágine, obra mundialmente leída del escritor huilense José Eustasio Rivera. La Gobernación del Huila a través de la Secretaría de Cultura, estará al frente de estas actividades el próximo lunes 25 de noviembre en el Centro de Convenciones a partir de las 8:00 a.m. “Vamos a tener un evento académico, un conversatorio con las personas invitadas, como investigadores que han hecho aportes a La Vorágine. Norma Donatto y Fernando Páramo, ellos van a estar dirigidos y acompañados por Isaías Peña, el escritor que viene haciendo investigaciones sobre la escritura de esta obra de José Eustasio Rivera” aseguró Betsabé Polanía, Secretaria de Cultura del Huila. La Banda Sinfónica del Huila presentará el estreno de Suite La Vorágine, una reconstrucción musical magistral del recorrido que hizo el escritor en el proceso de elaboración de su famosa obra literaria. Una vez más el talento de la Banda Sinfónica estará sobre los escenarios en esta importante celebración. “Tendremos en escena a la Banda Sinfónica del Huila, quien hará un arreglo musical sobre el caminar que hizo el escritor huilense sobre su obra La Vorágine en el proceso de su escritura. Además, vamos a tener a varios escritores, a quienes le haremos un reconocimiento especial desde la Secretaría de Cultura por la importante labor que vienen desempeñando con la literatura en el Huila”, puntualizó la funcionaria. La programación en Neiva se extiende hasta la noche, donde se hará la presentación de una obra de teatro en la plazoleta del centro de convenciones, dirigida por Juan Carlos Moyano, donde se recreará los escenarios y personajes de este emblema literario. Programación en Rivera En el municipio de nacimiento del escritor José Eustasio Rivera también hay una serie de eventos para conmemorar el centenario de La Vorágine. La alcaldía local realizará la feria del libro con una amplia programación. “Iniciamos el día sábado 23 y domingo 24 de noviembre con una feria del libro “FilVorágine” capítulo Rivera. Tendremos una agenda hasta las 10:00 p.m. donde habrá intervenciones de diferentes escritores e investigadores. Vamos a tener una actividad que viene desde el Ministerio de Cultura que se llama “Cátedra Vorágine”. El teatro municipal, las Termales de Rivera, el parque central, se vestirán de literatura” puntualizó Luis Felipe Obando, secretario de cultura de Rivera.  "
"Suite musical “La Vorágine”, una creación única para celebrar el centenario",https://www.huila.gov.co/cultura-y-turismo/publicaciones/15347/suite-musical-la-voragine-una-creacion-unica-para-celebrar-el-centenario/,https://www.huila.gov.co/info/huila_bco/media/pub/thumbs/thpub_400X400_15347.webp,"La banda sinfónica del Huila realizará el estreno mundial de la suite La Vorágine, una creación musical icónica que se presentará el próximo lunes 25 de noviembre en el marco de la conmemoración del c",Última modificación19/11/2024,"La banda sinfónica del Huila realizará el estreno mundial de la suite La Vorágine, una creación musical icónica que se presentará el próximo lunes 25 de noviembre en el marco de la conmemoración del centenario de La Vorágine. Neiva, 18 de noviembre de 2024. La Banda Sinfónica del Huila se enorgullece en anunciar el estreno mundial de la suite La Vorágine, una obra musical icónica que será presentada oficialmente el próximo lunes 25 de noviembre. Este evento se enmarca en la conmemoración del centenario de la novela La Vorágine, escrita por el huilense José Eustasio Rivera, una obra que, cien años después, sigue siendo un referente de la denuncia social frente a la explotación del caucho, la destrucción de la selva y la opresión de las comunidades indígenas. Este año, en el marco de la conmemoración del centenario de La Vorágine, la Gobernación del Huila, a través de la Secretaría de Cultura liderada por Betsabé Polanía, ha impulsado un espectáculo único que combina música, literatura y cultura en homenaje a esta obra emblemática. Para ello, se encomendó a la Corporación de la Banda Sinfónica del Huila, bajo la dirección del maestro Arcesio Bermúdez González, la creación de este tributo sonoro que resalta el legado cultural del Huila y del país. Durante el proceso creativo, el funcionario Julio César Manchola, junto con los maestros Wilder de Jesús Román y Jhon Henry Gutiérrez, desarrolló la idea de crear una interpretación musical de La vorágine como homenaje a este valioso legado cultural del Huila y de Colombia. A partir de esta iniciativa, el maestro Jhon Henry Gutiérrez asumió el desafío de convertirla en música, logrando, después de dos meses de intenso trabajo, dar vida a la suite La Vorágine, una obra que captura la esencia de esta icónica novela. Proceso creativo Julio César Manchola comenta el origen de esta importante iniciativa, “en el marco del centenario de la Vorágine, debíamos hacer algo novedoso y diferente, desde lo musical ya que no se había hecho nada desde la música, me puse a investigar el recorrido geográfico de La Vorágine y el desarrollo de ella. En este descubrir hay sonidos, instrumentos, ritmos muy autóctonos representativos de los lugares, de ahí Surge la idea de hacer un concierto musical de la Vorágine, que lo que se espera le dé la vuelta al mundo desde la misma vigencia de la obra”, afirmó. La obra está estructurada en forma de suite y consta de cuatro movimientos, denominados de la siguiente manera: el primer movimiento, Origen; el segundo, Selva; el tercero, Hombre contra selva; y el cuarto y último, Revelación. Cada sección ofrece un espectáculo musical que evoca los sonidos de la selva y captura los diferentes contextos de La vorágine. “Trabajamos desde la parte sensorial, utilizando los sonidos para describir con la música la selva, los animales y gran parte del contexto de la obra. Los cuatro movimientos integran ritmos autóctonos de las regiones, y cada uno resalta un aspecto clave de La vorágine, logrando narrar su historia a través de la música”, afirmó Jhon Henry Gutiérrez Penagos, director asistente de la Banda Sinfónica del Huila y compositor de la suite. Por su parte, el maestro Wilder de Jesús Román, encargado del ensamble y montaje de la suite, destacó: “Fue un trabajo bastante complejo, porque materializar la idea a través de la música en tan poco tiempo fue un desafío considerable. Requirió un esfuerzo articulado que involucró a más de 40 músicos y la integración de diversos ritmos y sonidos. Aunque la suite está escrita para el formato de la Banda Sinfónica del Huila, su lenguaje es universal”. Muestra especial para medios Hoy lunes 18 de noviembre, a las 3:00 p.m., se realizará un ensayo abierto de la suite La Vorágine en la Biblioteca Departamental del Huila, donde se presentará esta obra musical. Posteriormente, el 24 de noviembre se llevará a cabo un pre - estreno en el municipio de Rivera. Finalmente, el estreno oficial tendrá lugar el lunes 25 de noviembre, a las 8:00 a.m., en la Biblioteca Departamental, como parte de la programación de conmemoración del centenario de La vorágine. Esta suite es un tributo musical que promete emocionar a los asistentes y renovar el interés por una de las novelas más emblemáticas de Colombia."
